{"definitionVersion":"DADS 1.0-draft","application":{"name":"Test API","version":"1.0.0"},"modules":[{"name":"Products","endpoints":[{"name":"GetProduct","method":"GET","route":"/products/{id}","summary":"Get product","parameters":[{"name":"id","in":"path","type":"string","required":true}],"responses":[{"statusCode":"200","description":"OK","schema":"Product"}]}]}],"schemas":[{"name":"Product","type":"object"}]}
